Tweet Id;Datetime;retweetCount;likeCount;Text
1519257818204942337;2022-04-27 10:11:04+00:00;0;0; duzy siec pko problem wyplacac tys zloty bankomat 
1519257783841038337;2022-04-27 10:10:56+00:00;6;13; rosja wstrzymywac dostawa gaz polska wedlug analiza zagrozic naszej gospodarka analityk wskazywac wydawac przygotowana rezygnacja rosyjski gaz przecietny panstwo 
1519256774272077824;2022-04-27 10:06:56+00:00;1;4;godzina zapraszac webinar dezinformacja rozpoznawac falszywy news reagowac opowiedziec 
1519254216807788545;2022-04-27 09:56:46+00:00;0;0; crekb crcintyc wiedziec aliorbank pko euronet miec praktyke rybka denerwowac czlowiek wezme chciec 
1519253815236702208;2022-04-27 09:55:10+00:00;0;5; bank upasc pko bgz rok klient indywidualny istniec praktycznie bank pko struktura nbp tzw systema monobankowy 
1519249661021855744;2022-04-27 09:38:40+00:00;0;0; santadera dostac sms oferowac kredyt rrso wiec rzc pko dostac promocyjny warunek
1519248830126043137;2022-04-27 09:35:22+00:00;0;0; miec konto pko euronetu wyplacasz friko 
1519246782043152384;2022-04-27 09:27:13+00:00;0;1; adam numer nalezec ostrzegac takimi sytuacja strona 
1519243698848124929;2022-04-27 09:14:58+00:00;0;0; pewny pkobp pko podwyzszac oprocentowanie poprostu walic slepo 
1519242844703277058;2022-04-27 09:11:35+00:00;0;0; komu bronic klient pko polegac madrze wybrac bank sie miec darmowy usluga jak ignorant plakac gotowka moc wyplacic 
1519241344719499265;2022-04-27 09:05:37+00:00;0;1; tekst stylo kupic mieszkanie zloto albo akcja przecietny kowalski nie miesc pojecie catalyst nie onsic miesc miesc pojsc sobie pko kupic obligacja rzadzacy proponowac niski zagranica 
1519240525026672642;2022-04-27 09:02:21+00:00;0;1;pko out opl trzymac strata rok 
1519239180399824897;2022-04-27 08:57:01+00:00;0;0;pko jamalu luka podaz gaz max mld moc zostac uzupelniona 
1519237900742938625;2022-04-27 08:51:56+00:00;0;0;pko widac 
1519237328660742147;2022-04-27 08:49:39+00:00;0;1; jakbyscie zrobic gospodarstwo domowy gorz ladnie pokazalo popyt staly sezonowosc miec diachronic 
1519236553670725632;2022-04-27 08:46:35+00:00;0;0;pko jamalu luka podaz gaz max mld moc zostac uzupelniona 
1519236089978003457;2022-04-27 08:44:44+00:00;0;2; sezonowo zmienny czynnik spod stos ciezko zorientowac dynamika sezonowy pozostaly 
1519233951734325248;2022-04-27 08:36:14+00:00;0;0; wyprzedawac marny pieniadz poczytac polecac lista wyprzedaz lewandowski stocznie pis zamknac inwestor katarski mowic cukrownia tez pis sprzedawac pko tez 
1519233024860299264;2022-04-27 08:32:33+00:00;0;0; mariusz ograniczenie klient zewnetrzny klient bank moc jednorazowo wyplacic dowolny kwota ramy indywidualny limit ustalic ograniczenie techniczny sam bankomat zaleznie model lub banknot 
1519232083360686080;2022-04-27 08:28:49+00:00;0;0; musze zmartwic kupowac wciaz rosyjski gaza poprzez niemiecki posrednika
1519231296098246656;2022-04-27 08:25:41+00:00;0;1; pko tez chodzic bankomat kinszasa 
1519230853959749632;2022-04-27 08:23:56+00:00;1;11;polecac serdecznie analiza dotyczaca polska dac rada rosyjski gaza patrzyc punkt widzenie popyt podaczy ujecie sezonowy podpisanych kontrakt lng naszym zdacniem odpowied brzmiec dacmy rada 
