Tweet Id;Datetime;retweetCount;likeCount;Text
1519995157776633856;2022-04-29 11:01:00+00:00;0;0; wykres miec polska chwalic czolowka 
1519994171238629377;2022-04-29 10:57:05+00:00;0;0; games zawrzec pko umowa kredyt mln 
1519992225752625154;2022-04-29 10:49:21+00:00;0;0; oszczedzac pko miec minus gratulowac 
1519989581843685384;2022-04-29 10:38:51+00:00;1;3;inwestor zniechecic rynek nieruchomosc droga zamknac zbyt niski zdolnosc kredytowy przewidywac analityk pko 
1519988653845532672;2022-04-29 10:35:09+00:00;0;0; temu glowny analityk ekonomiczny pko tata wanna wchodzic maly zadawac pisdzielcami pierdolic zal sluchac zawsz wino putina albo tuska jebac pis pisdzielcow
1519987405335498752;2022-04-29 10:30:12+00:00;0;0; games zawarcie umowa kredyt pko lda 
1519986182444417024;2022-04-29 10:25:20+00:00;1;1;espi games zawarcie umowa kredyt pko 
1519985821981593600;2022-04-29 10:23:54+00:00;0;4; wig nieruchomosci 
1519984312271228928;2022-04-29 10:17:54+00:00;0;0;banki dodatkowa skladka bfg pko moc szykowac przejecia innej drogi 
1519982672814166016;2022-04-29 10:11:23+00:00;0;0;choc trudno uwierzyc polak nadal popelniac blad zlodziej wykorzystywac rok temu blad pieniadz znikac pko niestety polak robic nadal zapisywac pin swej karta platniczy karteczka trzymanej portfel samej karcie 
1519982266298028038;2022-04-29 10:09:46+00:00;0;6; drogi swieto cenaa zywnosc polska kwiecien wzrosc silnie koniec podwyzka cena zywnosc trendy zarowno globalny lokalny pozostawac raz nieublagany 
1519981332406759424;2022-04-29 10:06:04+00:00;0;0;gracz lks chciec rozwiazac kontrakt pomoc walka pko ekstraklasa 
1519981151959629824;2022-04-29 10:05:21+00:00;0;0;bank alarmowac pieniadz znikac konto polaki pko prosty blad wciaz klient popelniac 
1519975195687239680;2022-04-29 09:41:41+00:00;0;0; orka fundusz rzecz poszkodowany rodzina kwk owek owka pko line kontakt poszkodowany rodzina tel lub mail fundacjafrg 
1519974880535617536;2022-04-29 09:40:25+00:00;0;0; polska wykres manipisulacja 
1519974454654386176;2022-04-29 09:38:44+00:00;0;0; polska wykres lewy 
1519974042014527489;2022-04-29 09:37:06+00:00;1;4;gospodarek strefa euro kontynuowac wzrost problem fala omikron zaburzenie podazowy wojna ukraina pkb zwiekszyc ryzyko recesja uniknac niemiec spadek pkb raz wzrosc 
1519974006555910145;2022-04-29 09:36:57+00:00;0;0; prz inflacja jestescie tylu rynek
1519973620805734401;2022-04-29 09:35:25+00:00;1;7;rosnac zroznicowanie stopa inflacja poszczegolny panstwo strefa euro estonia inflacja hicp wzrosc malta francja oscylowac wokol trudny orzech zgryzienia ebc 
1519973608537440256;2022-04-29 09:35:22+00:00;5;12;inflacja hicp strefa euro kwiecien raz wzrosc minimalnie dynamik cenaa energia spowolnic marzec przyspieszac wzrost cenaa zywnosc uslugi 
1519971432800866304;2022-04-29 09:26:43+00:00;1;1; pamietac dokladnie rok wczesnie kredyt konsumpcyjny wziac pko zderzyc rzeczywistosc 
1519971387464687622;2022-04-29 09:26:33+00:00;0;1; giertych pisa realizowac swoja zlodziejaska polityke poniedzialek skladam pozew wobec czlonkow zarzad pko mld odszkodowanie wobec czarnecki itp
1519967344499515393;2022-04-29 09:10:29+00:00;0;3; bank pko liczyc kiedys usmiechy wegierski bank pojsc kosztowac forint 
1519966260959842305;2022-04-29 09:06:10+00:00;0;0;pko bank hipoteczny powolanie czlonek rada nadzorczy pko bank hipoteczny lda 
1519962585470279681;2022-04-29 08:51:34+00:00;0;0; miec pko konto pierwszy drugi walutowy zadawolona oprocz mulenia aplikacja git
1519962514188124161;2022-04-29 08:51:17+00:00;0;2; wiecej trzynastka zakupy szczepionka wybor kopertowy tarcza pewno udac 
1519958951625961473;2022-04-29 08:37:08+00:00;0;1; szczescie sierpien zszlego rok zaalarmowany wewnetrzny niepokoj podpisac aneks staly oprocentowanie pko czuc jakbym wygrac loteria miec oprocentowanie marza 
1519958705160302592;2022-04-29 08:36:09+00:00;0;1; pon miec konto pko jeszcz wierz 
1519952914663550977;2022-04-29 08:13:08+00:00;0;1; glapinski mowic stopa procentowy podwyzszac 
1519952684106883073;2022-04-29 08:12:13+00:00;0;1; szacunek kant 
1519952556008554497;2022-04-29 08:11:43+00:00;0;5; wierzyc 
1519950609394581505;2022-04-29 08:03:59+00:00;0;7;odpowied rpp podwyzka stopa procentowy posiedzenie przyszly tydzien 
1519950298655207424;2022-04-29 08:02:45+00:00;1;6;szacowac bazia wstepny dane cpi glowny miara inflacja bazowy cpi zywnosc energia paliwo wzrosc kwiecien marzec 
1519950099367198720;2022-04-29 08:01:57+00:00;0;4; brawo brawo wiecej glapinski wytrzymac 
1519949661959864320;2022-04-29 08:00:13+00:00;13;55;inflacja cpi kwiecien wzrosc marzec mocno dynamika cena ogolem podbic zywnosc proinflacyjne efekt wojna ukraina dlugo odczuwac szczyt inflacja dopiero miesiac 
1519948839700025344;2022-04-29 07:56:57+00:00;0;0; jadymy 
1519944299483439105;2022-04-29 07:38:54+00:00;0;0; plan plan koniec zielony majowka przejecie pko 
1519942609837473793;2022-04-29 07:32:12+00:00;1;3; miec pko getinem
1519942162108063744;2022-04-29 07:30:25+00:00;0;0; miec pko wczoraj 
1519941796167655424;2022-04-29 07:28:58+00:00;1;4; cjkone imo peo raczej wzglad nie skonczyc proces poprzedni resolution pko miec dobry pozycja kapitalowy
1519936183463206913;2022-04-29 07:06:39+00:00;0;0; drugi alegoria ekonomista siedziec 
1519935357080547328;2022-04-29 07:03:22+00:00;1;5; ciekawy raz stawiac pko
1519933618667376640;2022-04-29 06:56:28+00:00;0;0; widac troche wiac wschod 
1519928986348011520;2022-04-29 06:38:03+00:00;0;3; jaka piekny alegoria makro niby ladny perspektywa sporo chmura 
1519928056089096192;2022-04-29 06:34:22+00:00;1;2; polska norweski fundusz miec akcja kilkudziesieciu polski spolka bank pko pekao alior kghm lpp pkn orlen pzu wartosc miliard korona dysponowac takze pakiet rzadowy obligacja skarbowy 
1519922157727399943;2022-04-29 06:10:55+00:00;1;3;moc pobiec dowolny miejsce swiat dowolny pora wazny termin maj dolaczyc poznac wiecej szczegol wirtualny pko bialystok polmaratonie cnie ccz cczka 
1519920099771269120;2022-04-29 06:02:45+00:00;1;9; prawomocny klient pko wyrok szczecinie sygn akta umowa wazny zasadzenie pln ods kzp 
1519919432612597760;2022-04-29 06:00:06+00:00;0;1;inflacja mieszac finanse pko wprowadzac nowy inwestowanie 
1519913264053833728;2022-04-29 05:35:35+00:00;0;0;dli pko ready
1519910734351814656;2022-04-29 05:25:32+00:00;0;0;kolejny walka wladza raz pko pzu 
1519909389058064390;2022-04-29 05:20:11+00:00;0;8; pko ambicja prezesowski miec wiceprezes marcin eckert moc liczyc wsparcie szef rada nadzorczy bank maciej lopinski lopinski zajac namiecwianiem kaczynski emerytura 
1519896592895123457;2022-04-29 04:29:20+00:00;0;0;pko inwestycja tematyczny nowy mozliwosc inwestowania iko ipko inwestycja tematyczny nowy udostepniona funkcja serwis transakcyjny aplikacja mobilny pko bank polski 
1519893259950120960;2022-04-29 04:16:06+00:00;1;2;kolejny walka wladza raz pko pzu nasa koryto walczyc 
1519789667293573121;2022-04-28 21:24:27+00:00;0;0; jutro sprawdzic poki info linia pko zaprzeczyc napisac oficjalny mail zobaczyc
1519775147917467650;2022-04-28 20:26:45+00:00;0;1; zamknac shorty pko wzglad skup akcja wlasny 
1519770278968053761;2022-04-28 20:07:25+00:00;0;2; pko tyle zly ciazyc wciaz portfel kredyt frankowy realnie ksiegowo wplywac wynik
1519766309923430401;2022-04-28 19:51:38+00:00;0;1; pko oferowac promocja karta kredytowy zlodziej 
1519741227238936576;2022-04-28 18:11:58+00:00;0;0;mama miec gosc znajoma pko prywatnie zona pulkownik lwp znajoma miec rok imigrant postawa wykazywac stary towarzysz internacjonalistyczny 
1519740643265941505;2022-04-28 18:09:39+00:00;0;2; inflacja odpowiadac czynnik ekspansywny polityk fiskalny panstwo polityk monetarny rpp pandemia wojna ukraina mowic zbigniew jagiella prezes pko przekonywac inflacja zarabiac kredytobiorca 
1519739983191490564;2022-04-28 18:07:02+00:00;0;0; ograniczyc chyba dostep strona pko gusu 
1519715048821772289;2022-04-28 16:27:57+00:00;0;1; pzu pko miec problem shortowac 
1519708704379133961;2022-04-28 16:02:44+00:00;0;3;wynikac analiza przygotowanej pko bank polska zdolnosc kredytowy polaki znacznie spasc ciag ostatni kilku miesiac obnizyc pond polowa wzgledem 
1519708366393819137;2022-04-28 16:01:24+00:00;0;0; naszymi karty debetowy wydawanymi konto placic granica platnosc kart vis waluta waluta rachunek przypisana kart visa przeliczac kwota transakcja wedlug swoich kurs kurs mozna znale strona 
1519692032377298947;2022-04-28 14:56:29+00:00;0;2; wydatek panstwo budzet wysokosc wydanej kasa bona pko pln dolar pojsc byc zebrak
1519690366303227908;2022-04-28 14:49:52+00:00;0;0; zgadzac argumentacja pracodawca wzgledem pracownik moc zastapic tani obcokrajowiec pilnie poszukiwac kazdej praca
1519689104811778048;2022-04-28 14:44:51+00:00;0;0; calkowicie zgadzac max mld 
1519683775009103872;2022-04-28 14:23:40+00:00;0;0; oczywiscie dziwic miec konto pko nie miec oplata wyplata bankomat oplata miec wplata powyzej tys wiec wystarczyc wplacac 
1519680964225601537;2022-04-28 14:12:30+00:00;0;1; granica placic kart pko miec karte vis stan zaplacic granica kart 
1519680847225495553;2022-04-28 14:12:02+00:00;0;1;raport pko spadek zdolnosc kredytowy wzglad 
1519677046712119296;2022-04-28 13:56:56+00:00;0;0;zapraszac udzial pko polmaratonie katowickie czesc korona slaski polmaratonow spotykac maj 
1519672983840862208;2022-04-28 13:40:48+00:00;0;0; pekao pko rozny instytucja pragnac zauwazyc 
1519672292250427393;2022-04-28 13:38:03+00:00;0;8;poziom pkb usa obnizyc saar spadek prywatny inwestycja eksport wydatek publiczny hamowanie amerykanski gospodarka zbedny ograniczyc swiatowy inflacja 
1519671293850931200;2022-04-28 13:34:05+00:00;0;0; pozdrawiac 
1519670978103676928;2022-04-28 13:32:49+00:00;0;0; kolega moc pomachac drugi strona biuro 
1519670781768257537;2022-04-28 13:32:03+00:00;0;1; bank pko miec mln klient wiec zarobic srednio zloty kwartal 
1519667822573633536;2022-04-28 13:20:17+00:00;1;3; cecha doroslosc zadluzyc tez pamietac zadluzenie trzeba splacic 
1519667531442704384;2022-04-28 13:19:08+00:00;0;56;ekonomistka ekonomista pko razem biuro raz pierwszy pamietny czas 
1519666754276016128;2022-04-28 13:16:02+00:00;0;1; csz badan nbp mglisty ostatni analiza pko wskazywac rynek kredyt ciagle mowic rynek pierwotny rynek wtorny miec raport nbp zrobic gotowkowicze dojsc korekta nieruch 
1519665217730490373;2022-04-28 13:09:56+00:00;0;1; akurat zerowy stopa zakup gotowka jedyny sensowny opcja alokacja kapital cel pozniejszej odsprzedazy wynajm nbp podawac kwartalnie przekraczac transakcja
1519664064737251329;2022-04-28 13:05:21+00:00;0;0;swietny prezenta dziekowac pko 
1519661011548135425;2022-04-28 12:53:13+00:00;0;1; ilu czlowiek sklonny oszczedzac bierzacych dochod mieszkanie czekac zakup powiedziec rok jest gotowy kredyt drokego goly pomiara dochod jest slaby rynek miec kredyt
1519660352954322944;2022-04-28 12:50:36+00:00;0;2; chyba dobry wskaznik sredni wynagr cena wolumen udzielanych mtg udzielanych kredyt ogolem ekspert rynk nieruch ale bym patrzyc wskazniki 
1519655620407926784;2022-04-28 12:31:48+00:00;5;3;samorzad wchodzic okres duzy niepewnosc solidny nadwyzka mld wynik biezacy rosnacy koszt obnizenie wplywy pit wplynac tegoroczny wynik zapraszac lektura raport 
1519655081926352896;2022-04-28 12:29:40+00:00;0;0; kolejny brednia kupowaniem gotowka wedlug raport nbp zakup gotowka wkladac wartosc nieruchomosc wklad wlasny 
1519654663276146691;2022-04-28 12:28:00+00:00;0;3; miec takiej skala podwyzka zarowno minimalnie przynajmniej nie ostatni leciu spadek zdolnosc rok zaledwie wzrost wynagrodzenie miec kwiecien czerwiec ostry hamowanie
1519654038119329794;2022-04-28 12:25:31+00:00;0;1; zawsze takiej skala zaostrzaniu pol mon miec efekt duzy obnizka zdolnosc kredo chyba nie zawsze poprzedzaje banka rynka nieruch sens traktowac wykres dowod poszlakowy rynka napompowany niewatpliwie 
1519651038520877058;2022-04-28 12:13:35+00:00;0;0; szy wykres pochodzic raport pokazac poziom powszechnie uznawany szczyt poprzedni hossa pokazywac sredni pensja potrzebowac wziac standardowy kredyt zdolnosc mocno spasc wiec przebijac 
1519650141082468352;2022-04-28 12:10:02+00:00;0;2; wykres akurat dowod banka 
1519647321721556992;2022-04-28 11:58:49+00:00;0;0;pko liczba kredyt hipoteczny spasc tys wartosc mld 
1519646120850247680;2022-04-28 11:54:03+00:00;0;0;pko liczba kredyt hipoteczny spasc tys wartosc mld 
1519642264737361921;2022-04-28 11:38:44+00:00;0;0; zdolnosc kredyt polaki spasc porownanie poprzedni rok rynka obronic zdanie 
1519640869640577027;2022-04-28 11:33:11+00:00;0;3; dodatkowo zawodowo dopisac kupujacy rok pierwszy rzut oko budzic watpliwosc nazwac moznosc nabycie nieruchomosc stac bank dawac szeroki dostep hip niepotrzebnie wzbudzic aspiracja stan
1519639827259531271;2022-04-28 11:29:03+00:00;0;3; choc troche powiazany rynek nieruchomosc wiedziec faza dmuchania banka zamknac kupujacy ultratanie kredyt piec dwunasty wzrost stopa stopa wiadomo sierpien wrzesien 
1519639612901240832;2022-04-28 11:28:11+00:00;0;0;pko strategia obligacyjny fiz raport kwartalny lda 
1519637599266168836;2022-04-28 11:20:11+00:00;0;0;pko globalny strategia fiz raport kwartalny lda 
1519636588166328320;2022-04-28 11:16:10+00:00;0;0;pko absolutnej stopy zwrot europa wschod zachod fiz raport kwartalny lda zachodfiz
1519635655160123393;2022-04-28 11:12:28+00:00;17;36;wzrost stopa procentowy zmiana zasada wyliczania zdolnosc kredytowy spowodowac zdolnosc obnizyc polowa wzgledem spasc popyt mieszkanie zapraszac lektura raport 
1519632981677199361;2022-04-28 11:01:50+00:00;2;15;miesiac temu przeczytac banka nieruchomosc miec analiza wibor mozna sporo nabyc zdolnosc tymczasem cudo nowy raport boom csz 
1519632693750898691;2022-04-28 11:00:42+00:00;0;0; studium poznan okolica rok student miec karta wbk pko rodzica musiec chodzic czek oddzial utrzymac miec wielki baza klient 
1519632057726652417;2022-04-28 10:58:10+00:00;0;0; blad zly pko 
1519631861105975296;2022-04-28 10:57:23+00:00;0;0; bank pko sprzedany polski kapitala czek nie pamietac rok 
1519631369005158400;2022-04-28 10:55:26+00:00;1;2; pko inteligentny dom voiceboty asystent glosowy iko czolowka zestawienie bankowy innowacja rok wedlug uznanie brawa moich kolezanka kolega 
1519631003568025600;2022-04-28 10:53:59+00:00;0;0; cciejrudke sumiec racja wedlug pko miec takiego problem patrzac wartosc aktywa zysk netto bank
1519630541439574017;2022-04-28 10:52:09+00:00;0;0; chyba mln pko suma zaraz problem miec maj program zawierania ugoda
1519629887983783938;2022-04-28 10:49:33+00:00;0;1; warto dodac portfel frankowy miec marginalny porownanie chocby pko
1519627688423526401;2022-04-28 10:40:48+00:00;0;0; pko bastardo infinito
1519624921927794688;2022-04-28 10:29:49+00:00;0;1; dramatyczny dramatycznie nieodpoaiwdzlane utrzymywanie niski cena pieniadza bylo nienormalne deweloper oblowonli dzieki kuna taraz potworny dlug byc spalcali kredytobiorca posrednio inflacja 
1519620929936142336;2022-04-28 10:13:57+00:00;0;0; nowy projekt wprowadzane miec widocznie wysoki cena wprowadzane okolo mcy temu dac tanio produkowac mieszkanie sie oplacac 
1519615678524833793;2022-04-28 09:53:05+00:00;0;1; miastoo nadal nizej wiekszosci kwartalow jll deweloper opozniac zmniejszyc liczbe wprowadzanych projektow maj dobry sytuacja finansowy duzi miastoo nieznacznie
1519615403462328320;2022-04-28 09:51:59+00:00;0;1; niestety nowy wiedziec zakupy kredyt mniej 
1519615087622897664;2022-04-28 09:50:44+00:00;1;0;wskazywac zdolnosc kredytowy obnizyc polowa wzgledem rok okolo trzeci ubytek odpowiadac wzrost stopa procentowy okolo trzeci zaostrzenie polityka kredytowy 
1519609096080695298;2022-04-28 09:26:56+00:00;0;12; polecac
1519607057778941952;2022-04-28 09:18:50+00:00;0;10; chciec czytac takim klasyk 
1519606182427643905;2022-04-28 09:15:21+00:00;0;1; oferta deweloperow warszawa wzrosla wiecej mieszkan wprowadzac oferta sie sprzedawac 
1519606025896275970;2022-04-28 09:14:44+00:00;0;4; tez uwazam mocno zawyzona prognoza tys kredytow wartosc okolica mld max ryzyko ciagna dol 
1519605787127078913;2022-04-28 09:13:47+00:00;0;7; skromny zdanie dobic mld 
1519605279440187393;2022-04-28 09:11:46+00:00;0;2; dobry waw chyba brane gotowka lokata inflacja waw zmienic podaz spasc opiekuncz panstwo odczuc najwiecej potrzbuja miec info kredyt niesplacanych 
1519605176734302208;2022-04-28 09:11:21+00:00;0;0;wykres pokazujace duzy miasto luty zniknac oferta najem mieszkanie wzrosc cena najem 
1519604271075016715;2022-04-28 09:07:45+00:00;2;13;wedlug nastapic wyhamowanie wzrost presja placaowy przedsiebiorstwo udzial firma prognozujacych wzrost placa spasc nadal wysoki tlo historyczny 
1519603927737675776;2022-04-28 09:06:23+00:00;1;3;obawa szok odplyw ukrainski pracownik polski firmaa wedlug badanie kluczowy wyzwanie zwiazane wojna wsrod firmaa transportowy budowlany 
1519603574338162688;2022-04-28 09:04:59+00:00;0;0; ciekawy dramatyczny zarazem szacujemy wartosc udzielonych kredyt moc spasc mld mld liczba tys tys rok ubiegly 
1519602500265025536;2022-04-28 09:00:43+00:00;0;0; mogielnicki przesadzic 
1519602484658024448;2022-04-28 09:00:39+00:00;1;4; inwestycja tematyczny nowy funkcja serwis transakcyjny ipko aplikacja iko rozwiazanie ulatwiac inwestowanie umozliwiac wykorzystanie inspiracja plynacych decyzja inwestor sprawdzic 
1519601880267173890;2022-04-28 08:58:15+00:00;2;4;wedlug firmaa badany inflacja wciaz kluczowy problem mierzyc drugie czesty wskazanie wojna negatywny konsekwencja odczuwac firmaa 
1519601793432444930;2022-04-28 08:57:55+00:00;16;150;link nowy dobry analiza dotyczacej obecny sytuacja rynek mieszkaniowy 
1519601652768067584;2022-04-28 08:57:21+00:00;0;0; blokowac dowod pko przebiec bezproblemowo 
1519600531592957954;2022-04-28 08:52:54+00:00;1;3; rekordowo wysoki dynamika zapasy odsetka przedsiebiorstwo informujacych zbyt niski relacja potrzeba stan zapasy prod gotowy towar nieznacznie spasc wciaz ksztaltowac poziom zblizony historyczny maksimum 
1519598865460056065;2022-04-28 08:46:16+00:00;0;5;wedlug nowy szybki monitoring kurs oplacalnosc eksport przesunac gora eurpln dla usdpln kursa oplacalnosc import dla eurpln wzrosc dla usdpln 
1519597633576263680;2022-04-28 08:41:23+00:00;2;10;jastrzebia zaskoczenie szwecja reakcja rosnacy presja inflacyjny wysoki inflacja rok riksbank zdecydowac podwyzka stopa bazowy bank prognozowac ciag trzy rok kontynuowac podwyzka poziom nieco ponizej 
1519588058500374529;2022-04-28 08:03:20+00:00;0;0; ramy apel wplynac panstwowy pko zrobic
1519579089287491584;2022-04-28 07:27:41+00:00;0;0; sluszny uwaga pko ideowy prawica inicjatywa tzw pobozny zjednoczonej prawica skora marksistowski 
1519574826431692801;2022-04-28 07:10:45+00:00;0;0; marzec powrocic tendencja obserwowana wiekszosc wysoki dynamika masa zaladunek wyladunek polski porto morski ropa naftowy wegiel koks odpowiednio 
1519574820303872002;2022-04-28 07:10:44+00:00;0;0; marzec udzial ropa naftowy ladunek zaladowanych wyladowanych polski porto morski spasc luty wyniesc srednio udzial zaladunek wyladunek wegiel koks obnizyc odpowiednio osiagnac 
1519574813949444096;2022-04-28 07:10:42+00:00;0;0; marzec wysoki roczna dynamika zaladunek wyladunek porto morski charakteryzowac ladunek masowy ciekly pozostaly ladunek drobnicowy miesiac rzad zanotowac spadek ladunek masowy suchy marzec 
1519574807607746562;2022-04-28 07:10:41+00:00;0;0; marzec zaladowac wyladowac polski porto morski mln ladunek wiecej luty srednio marzec ladunek ogolem stanowic ladunek masowy ciekly masowy suche 
1519574799902720002;2022-04-28 07:10:39+00:00;0;1; marzec przewie mln tona ladunek transport samochodowy kolejowy tempo wzrost przewoz ladunek ogolem spasc luty przecietnie marzec wysoki dynamik transport rurociagowy 
1519574792940277761;2022-04-28 07:10:37+00:00;0;5; marzec przewie mln pasazer komunik miejski transport kolejowy samochodowym przewoz ogolem wzrosc luty srednio duzy odbicie przewoz samochodowych wynikac niski baza 
1519567622202966016;2022-04-28 06:42:07+00:00;0;0; pko obnizyc rekomendacja oponeo trzymac cena docelowy 
1519558984172199937;2022-04-28 06:07:48+00:00;2;30;sztuczny inteligencja obsluzyc mln klient pko przeprowadzic mln rozmowy
1519443960623681537;2022-04-27 22:30:44+00:00;0;2; kontrakt jamalski konczyc chyba normalny polska sie przygotowac inaczej oznaczac sasinozada ogarnac resort 
1519404959577612288;2022-04-27 19:55:46+00:00;0;0; dokladnie bankomat pko przypadac kilkanascie euronetu pko moc reka wyciagnac stac czlowiek kolek trwacc trwacc chodzenie kasa bank konto premium strata czas 
1519404945782542341;2022-04-27 19:55:42+00:00;0;0; marcin webinar edukacja dotyczacej bezpieczenstwo siec kontekst bankowosc tez jest istotny
1519402517192486912;2022-04-27 19:46:03+00:00;0;0;pko bank polski fake news chronic dezinformacja bank 
1519397398694531076;2022-04-27 19:25:43+00:00;0;1; nie aca odsetka trzymanej forsy rok pko odsetka lokata grosze rok
1519397328221880322;2022-04-27 19:25:26+00:00;0;0; nie aca odsetka trzymanej forsy rok pko odsetka lokata grosze rok 
1519392051476975616;2022-04-27 19:04:28+00:00;0;1; zgoda fwiw myslic dawny miesc szeroki atrakcyjny oferta detaliczny rozbudowana siec sprzedaz bank pko 
1519389734002438144;2022-04-27 18:55:16+00:00;0;0;fake news chronic dezinformacja pko bank polska 
1519381669266006016;2022-04-27 18:23:13+00:00;0;0; wiedziec zdziwic ostatnio zadzwonila infolinia pko automatyczny xdd
1519375659684007937;2022-04-27 17:59:20+00:00;0;2; drozsi aliora papierologia wielki pko zajebiscie wysoko postawic poprzeczka
1519366308068044801;2022-04-27 17:22:10+00:00;0;0;ferra zawarcie aneks umowa limit kredytowy wielocelowego pko lda 
1519356308339765249;2022-04-27 16:42:26+00:00;3;3;rozpoznac falszywy konto medium spolecznosciowy jak weryfikowac fakt siec czym deepfake trwac webinar dolaczyc 
1519345078094946306;2022-04-27 15:57:49+00:00;2;3;interesowac temat dezinformacja fake news wlaczyc webinar dowiedziec rozpoznawac falszywy news reagowac 
1519343303715659776;2022-04-27 15:50:46+00:00;0;0;pko bank polski nadac swoj przyjazny login logowac wygodno 
1519334896052887554;2022-04-27 15:17:21+00:00;0;0; pilne nowy pomysl rzad ograniczenie zysk bank skup akcja wlasny 
1519330844292308993;2022-04-27 15:01:15+00:00;0;0; dokladnie rok temu dzienie majowka wyplacac hajs santander max transakcja dziennie euronet max limita transakcja karta milo zaskoczyc pko wyplacac musiec limitay pozmieniac 
1519320627643133954;2022-04-27 14:20:39+00:00;0;2; santander ing pko inteligo miec podobnie
1519319192910143489;2022-04-27 14:14:57+00:00;1;4; bliski czas oczekiwac gwaltowny wyhamowania inwestycja szacowanym wzrost proc rok rok pierwszy kwartal prognozowac spadek proc drugie sprawa inwestycja prywatny pko 
1519312361668153345;2022-04-27 13:47:49+00:00;0;0; gadacie panstwowy pko brac luza tys raz 
1519302242305777666;2022-04-27 13:07:36+00:00;0;0; pracowac wymagac zmiana serwis test miec nadzieja niedlugo miec przekazania dobry wiadomosc 
1519301217301708800;2022-04-27 13:03:32+00:00;0;0; mocno iluzoryczny wysoki oprocentowanie jest zwyczajnie zabezpieczenie wysokon zysk wysokon skladka odprowadzacnych budzet samo pko odprowadzac mld cit rocznie bank kilkaset mln walczyc kredytobiorca naiwniakiem 
1519298810371002368;2022-04-27 12:53:58+00:00;0;2; dzieki 
1519295720855162880;2022-04-27 12:41:41+00:00;0;1; rzad nadzor nbp chciec kredyt hipoteczny bylyby tani mowic zbigniew jagiella dawny prezes pko 
1519293869401198592;2022-04-27 12:34:20+00:00;0;0; alior pekao pko inteligo pocztowy envelo bos bank rzad agenda nfos obsadzac rada nadzorczy wiec zarzad imposybilizm pisowski wykonanie 
1519292423041654789;2022-04-27 12:28:35+00:00;0;0; bank pko sry miss click tys 
1519291973563203585;2022-04-27 12:26:48+00:00;0;0; pko
1519289946028359682;2022-04-27 12:18:44+00:00;0;1; oczywiscie przekazac informacja departament bezpieczenstwo szczegol dotyczace weryfikacja tozsamosc osoba dzwoniacej naszej strona 
1519289603626311680;2022-04-27 12:17:23+00:00;0;2; przestepca dzwonic rozny miejsce swiat korzystac ulomnosc gsm telefonia odbiorca moc wyswietlic dowolny numer tel podawac sie pracownik bank warto poprosic weryfikacja pracownik iko przyjsc powiadomic jeon dane
1519287826034135047;2022-04-27 12:10:19+00:00;0;1;mlodziezowiec lacznie spedzic boisko minuta nadal czolo pozostawac bramka kolejka swoja silny pozycja umocnic krzysztofa kubic 
1519286893216739329;2022-04-27 12:06:36+00:00;1;6;panstwowy pko pekao alior bos pocztowy wiec apelowac zrobic 
1519284477469630465;2022-04-27 11:57:01+00:00;1;1;rzad nadzor nbp chciec kredyt hipoteczny bylyby tani mowic zbigniew jagiella prezes pko rozmowa 
1519284290470785024;2022-04-27 11:56:16+00:00;0;0; banki zalezne pis pko pekao getin alior bos pocztowy
1519277093925920769;2022-04-27 11:27:40+00:00;0;0; doradca klient pko robic czy temat stwierdzenie gora watek dyskriminacja goegraficzna nieprawda 
1519274374066491393;2022-04-27 11:16:52+00:00;0;0; prosze pieknie autocorrecty przeszkodzily thx
1519273826940596224;2022-04-27 11:14:41+00:00;0;6; ponizej lifting wykres zmienny popyt gaza strona gospodarstwo domowy handel uslugi elektrocieplownia 
1519264712483033088;2022-04-27 10:38:28+00:00;0;0; pko problem 
1519262263831576577;2022-04-27 10:28:44+00:00;0;1; hmm czerpac panstwo dany fundusz inwestycyjny sektor prs stan realnie wplynac stawka czynsz polska zgodnie dane pko raport knight frank polska miec obecnie mln mieszkanie wynajem rynka prs posiadac 
1519261844044759041;2022-04-27 10:27:04+00:00;0;0; nowosc pko rok temu bank miec 
1519261321489006596;2022-04-27 10:25:00+00:00;0;6;polska start przykuc uwaga inwestor kapital doswiadcznie ciekawy osoba swiat biznes chciec rozwinac polska granica produkt cyfrowy platforma klub liga federacja sportowy uwierzyc prezs pko 
1519258610894790657;2022-04-27 10:14:13+00:00;0;1; prawda detaliczny pko warunki catalyst zarezerwowany zagranica pko miec dom miecklerski zalatwic nie wspominajac ike obligacja detaliczny papier byc podatek belka 
